{
  "schema_version": 1,
  "format": "capplusplus_content_coverage",
  "scope": "Historical retail file-family ledger; not the Steam 1.01 release inventory or a claim that every field is decoded.",
  "sources": {
    "shared_core": {
      "expected_files": 72,
      "inventory_status": "enumerated",
      "identity": "The 72 hashes in src/capplus_inspect/known.py; shared by analyzed DOS and Windows builds."
    },
    "gam_image": {
      "expected_files": 1001,
      "inventory_status": "enumerated",
      "sha256": "93f0e53c7cf62abe5bd1f3369b07254a6a73a0cbe5739058acbcd3ff66bea7ab",
      "identity": "2048-byte-sector ISO-9660 CapPlus.gam. The SHA-256 is from the prior complete 279,402,496-byte image verification. This pass recounted directory entries from a truncated 36,738,560-byte local copy (SHA-256 c360f14629ad6ca5f1b00e9fa2127b68cdcd29ba80362d16dcdf3f1322052e0a); it did not reverify the full image or payloads."
    }
  },
  "retail_reconciliation": {
    "expected_files": 1604,
    "enumerated_sources": [
      "shared_core",
      "gam_image"
    ],
    "unclassified_files": 531,
    "status": "incomplete",
    "notes": "Prior verified disc comparison established both disjoint path sets on the retail CD. The remaining 531 files (603 additions minus 72 shared core files) need an explicit fresh inventory; setup, drivers, manuals and demos must not be blanket-classified as irrelevant. CDDA tracks are not filesystem files."
  },
  "non_file_content": [
    {
      "id": "cdda_music",
      "requirement": "classic",
      "observed_tracks": 8,
      "coverage": {
        "framing": "partial",
        "preservation": "untested",
        "semantics": "partial",
        "behavior": "unverified"
      },
      "issues": [
        5
      ],
      "evidence": [
        "docs/audio.md",
        "docs/content-coverage.md"
      ],
      "notes": "Historical retail tracks 2-9 and bounded CUE geometry; Windows logical selections 1-8 map to tracks 2-9. Fresh BIN verification, runtime behavior and DOS selector reachability remain pending."
    }
  ],
  "families": [
    {
      "id": "game_sets",
      "patterns": [
        "gameset/*.set"
      ],
      "observed_counts": {
        "shared_core": 3
      },
      "requirement": "classic",
      "coverage": {
        "framing": "complete",
        "preservation": "exact",
        "semantics": "partial",
        "behavior": "unverified"
      },
      "issues": [
        7
      ],
      "evidence": [
        "docs/formats.md"
      ],
      "notes": "Embedded DBF structure is decoded; economic interpretation and all cross-table references are not complete."
    },
    {
      "id": "game_set_images",
      "patterns": [
        "gameset/*.ii",
        "gameset/*.ii2",
        "gameset/*.dfi",
        "gameset/*.fi",
        "gameset/*.ip",
        "gameset/*.pic"
      ],
      "observed_counts": {
        "shared_core": 12
      },
      "requirement": "classic",
      "coverage": {
        "framing": "complete",
        "preservation": "exact",
        "semantics": "partial",
        "behavior": "unverified"
      },
      "issues": [
        6,
        7
      ],
      "evidence": [
        "docs/validation.md",
        "docs/graphics.md"
      ],
      "notes": "Every decoded image has a stable source/record ID, geometry, hash and storage group. Animation timing and original placement remain unverified."
    },
    {
      "id": "layout_plans",
      "patterns": [
        "gameset/*.pla",
        "gameset/*.plo",
        "gameset/*.plp"
      ],
      "observed_counts": {
        "shared_core": 9
      },
      "requirement": "classic",
      "coverage": {
        "framing": "complete",
        "preservation": "exact",
        "semantics": "partial",
        "behavior": "unverified"
      },
      "issues": [
        7
      ],
      "evidence": [
        "docs/ui-resources.md"
      ],
      "notes": "Ordered categories and 3x3 cells are framed; some IDs and pointer handling remain inferred."
    },
    {
      "id": "maps",
      "patterns": [
        "maps/*.map"
      ],
      "observed_counts": {
        "shared_core": 15
      },
      "requirement": "classic",
      "coverage": {
        "framing": "complete",
        "preservation": "exact",
        "semantics": "partial",
        "behavior": "partial"
      },
      "issues": [
        9
      ],
      "evidence": [
        "docs/formats.md",
        "docs/maps.md",
        "docs/terrain.md"
      ],
      "notes": "Executable-confirmed header, optional blocks, signed heights and counted city-array header. Full-map shading, partial editor rectangles and post-shading terrain IDs, shoreline transitions, climate, rainfall and soil fertility are checked against isolated DOS/Windows functions. Five source-cell bytes, two runtime-cell bytes and city-record offset 4 remain opaque; whole-game behavior is unverified. See docs/maps.md and docs/terrain.md."
    },
    {
      "id": "fonts",
      "patterns": [
        "resource/fnt_*.res"
      ],
      "observed_counts": {
        "shared_core": 3
      },
      "requirement": "classic",
      "coverage": {
        "framing": "complete",
        "preservation": "exact",
        "semantics": "partial",
        "behavior": "unverified"
      },
      "issues": [
        6
      ],
      "evidence": [
        "docs/ui-resources.md",
        "docs/graphics.md"
      ],
      "notes": "All 286 glyph slots have stable code IDs and bit geometry, including empty slots. Runtime colors and complete in-game layout behavior remain unverified."
    },
    {
      "id": "cursor_table",
      "patterns": [
        "resource/cursor.res"
      ],
      "observed_counts": {
        "shared_core": 1
      },
      "requirement": "classic",
      "coverage": {
        "framing": "complete",
        "preservation": "exact",
        "semantics": "partial",
        "behavior": "unverified"
      },
      "issues": [
        6
      ],
      "evidence": [
        "docs/ui-resources.md",
        "docs/graphics.md"
      ],
      "notes": "Seven image references and source hotspots resolve to catalog IDs; the EDIT row remains explicitly blank. Interaction/fallback behavior is not certified."
    },
    {
      "id": "cursor_images",
      "patterns": [
        "resource/i_cursor.res"
      ],
      "observed_counts": {
        "shared_core": 1
      },
      "requirement": "classic",
      "coverage": {
        "framing": "complete",
        "preservation": "exact",
        "semantics": "partial",
        "behavior": "unverified"
      },
      "issues": [
        6
      ],
      "evidence": [
        "docs/ui-resources.md",
        "docs/graphics.md"
      ],
      "notes": "Seven indexed images are linked to cursor rows using record-prefix offsets, including offset zero. Full runtime pointer behavior remains unverified."
    },
    {
      "id": "help",
      "patterns": [
        "resource/help.res"
      ],
      "observed_counts": {
        "shared_core": 1
      },
      "requirement": "classic",
      "coverage": {
        "framing": "complete",
        "preservation": "exact",
        "semantics": "partial",
        "behavior": "unverified"
      },
      "issues": [
        6
      ],
      "evidence": [
        "docs/ui-resources.md"
      ],
      "notes": "Ordered text and rectangles decode; engine interactions remain unimplemented."
    },
    {
      "id": "text_screens",
      "patterns": [
        "resource/text.res"
      ],
      "observed_counts": {
        "shared_core": 1
      },
      "requirement": "classic",
      "coverage": {
        "framing": "complete",
        "preservation": "exact",
        "semantics": "partial",
        "behavior": "unverified"
      },
      "issues": [
        6
      ],
      "evidence": [
        "docs/ui-resources.md"
      ],
      "notes": "DOS character/attribute pairs decode; native rendering parity is unverified."
    },
    {
      "id": "language_glyphs",
      "patterns": [
        "resource/language.res"
      ],
      "observed_counts": {
        "shared_core": 1
      },
      "requirement": "classic",
      "coverage": {
        "framing": "complete",
        "preservation": "exact",
        "semantics": "partial",
        "behavior": "unverified"
      },
      "issues": [
        6
      ],
      "evidence": [
        "docs/ui-resources.md"
      ],
      "notes": "Glyph order is preserved, but semantic character assignments are unknown."
    },
    {
      "id": "palettes",
      "patterns": [
        "resource/pal_std.res",
        "resource/ifcolor.res"
      ],
      "observed_counts": {
        "shared_core": 2
      },
      "requirement": "classic",
      "coverage": {
        "framing": "complete",
        "preservation": "exact",
        "semantics": "partial",
        "behavior": "unverified"
      },
      "issues": [
        6
      ],
      "evidence": [
        "docs/formats.md",
        "docs/graphics.md"
      ],
      "notes": "Both RGB palettes are cataloged. DOS/Windows loaders reduce channels to six bits; Windows upload expands by shifting left two. Per-call selection, cycling and display behavior remain unverified."
    },
    {
      "id": "resource_images",
      "patterns": [
        "resource/i_*.res"
      ],
      "exclude": [
        "resource/i_cursor.res"
      ],
      "observed_counts": {
        "shared_core": 17
      },
      "requirement": "classic",
      "coverage": {
        "framing": "complete",
        "preservation": "exact",
        "semantics": "partial",
        "behavior": "unverified"
      },
      "issues": [
        6
      ],
      "evidence": [
        "docs/validation.md",
        "docs/graphics.md"
      ],
      "notes": "Every decoded image has a stable catalog entry and source-order group. Ten non-image scenario-interface members remain explicit; real animation and placement semantics are unfinished."
    },
    {
      "id": "terrain_table",